{
  "name": "sensei_lifecycle_undeclared_states",
  "category": "checker",
  "subcategory": "states",
  "description": "Agent referencing undeclared lifecycle states block is rejected",
  "input": "agent broken\n  lifecycle: BogusStates\n  on start\n    say \"hello\"\n",
  "expected": {
    "outcome": "compile_error",
    "error_code": "E040",
    "error_contains": ["unknown lifecycle"]
  }
}
