{
  "name": "sensei_task_answer_sure",
  "category": "runtime",
  "description": "Task answer_forge_question dispatches on sure confidence and gives the result directly",
  "input": "use\n  llm.reason\n\ntask answer_forge_question\n  needs question: Text, context: Text\n  gives Text\n  do\n    result = reason \"You are forge-sensei. Using this prior knowledge:\\n{context}\\n\\nAnswer this FORGE question: {question}\"\n    when result.sure -> give result\n    when result.unsure -> give \"Uncertain: {result}\"\n    else -> give \"I could not answer this question confidently.\"\n\nfn main\n  result = answer_forge_question(\"What is a pure function?\", \"Pure functions have no side effects.\")\n  say result\n",
  "mock_responses": [
    {"text": "A pure function in FORGE is a deterministic computation with no side effects.", "confidence": 0.92}
  ],
  "expected": {
    "outcome": "run_ok",
    "trace_shape": ["task_call", "llm_request", "llm_response", "when_dispatch", "task_return"]
  }
}
